"id","nombre","resumen","telefono","tamano","ubicaciones","fundacion","sector","sitio_web","sede","especialidades","codigo_postal","ciudad","empleados","url"
33165,"UNIFORMES LIZAO","UNIFORMES LIZAO is an apparel & fashion company based out of Culiac치n Rosales, Mexico.",,"51-200 employees","{""1"": {""Direcci칩n"": ""Crist칩bal Colon 925 Pte. Col. Centro, Culiac치n, Sinaloa, Culiac치n, Sinaloa 80000, MX""}, ""2"": {""Direcci칩n"": ""CALLE CRIST칍BAL COL칍N 925""}}",,"[""Retail Apparel and Fashion""]","[""https://www.lizao.mx/\n      \n\n\n\nExternal link for UNIFORMES LIZAO""]","[""Culiac치n, Sinaloa""]","[]","{""1"": ""80000""}","Culiac치n Rosales,  Sinaloa,  M칠xico","[{""Nombre"": ""Lu칤s Parra"", ""Cargo"": ""Bar Waiter en Lizao"", ""Foto"": ""https://media.licdn.com/dms/image/v2/C4D03AQFzt3o1SP95kg/profile-displayphoto-shrink_100_100/profile-displayphoto-shrink_100_100/0/1550352615425?e=2147483647&v=beta&t=AwOkVwwxyBwnRg8DORbba64RoVXOchZY2bwMVNgs0Fw"", ""Perfil"": ""https://mx.linkedin.com/in/lu%C3%ADs-parra-492b9417b?trk=org-employees""}, {""Nombre"": ""Omar Humberto Gutierrez Carrillo"", ""Cargo"": ""Analista de Licitaciones"", ""Foto"": ""https://media.licdn.com/dms/image/v2/D5603AQFEgjDsQLZ9cg/profile-displayphoto-shrink_100_100/profile-displayphoto-shrink_100_100/0/1667507561805?e=2147483647&v=beta&t=Z6yhIuo8rVJSr9s8I9W9p2b6UhkPSIcZYPdc9oryG2c"", ""Perfil"": ""https://mx.linkedin.com/in/omar-humberto-gutierrez-carrillo-a38518195?trk=org-employees""}, {""Nombre"": ""Jorge Ernesto Salazar Velarde"", ""Cargo"": ""Ejecutivo de Licitaciones P칰blicas en Uniformes Lizao"", ""Foto"": ""https://media.licdn.com/dms/image/v2/C4E03AQG2_6DEJKVzpA/profile-displayphoto-shrink_100_100/profile-displayphoto-shrink_100_100/0/1603142092811?e=2147483647&v=beta&t=0gWGhiIFH7x-DQkZdymMo0DDT-WFh7AGn6h3n6_tk3k"", ""Perfil"": ""https://mx.linkedin.com/in/salazarvelarde?trk=org-employees""}, {""Nombre"": ""Arturo Diaz Lopez"", ""Cargo"": ""Opersdor de maquina industrial  en UNIFORMES LIZAO"", ""Foto"": ""https://media.licdn.com/dms/image/v2/C5603AQHmEBz6Oh99oA/profile-displayphoto-shrink_100_100/profile-displayphoto-shrink_100_100/0/1593963733972?e=2147483647&v=beta&t=TUtecLJ5k6gNVdVdjBcyqbpQMGf2nlmW6F4EY2Hucdk"", ""Perfil"": ""https://mx.linkedin.com/in/arturo-diaz-lopez-897a8b1b1?trk=org-employees""}]","https://www.linkedin.com/company/uniformes-lizao/"
33166,"Gasolineras PABA","Venta de combustibles, lubricantes y aditivos al detalle y al por mayor.",,"51-200 employees","{""1"": {""Direcci칩n"": ""Francisco Labastida Ochoa 1320 Desarrollo Urbano Tres R칤os, Culiac치n, Sinaloa 80027, MX""}}","1994","[""Wholesale Petroleum and Petroleum Products""]","[""http://paba.com.mx/\n      \n\nExternal link for Gasolineras PABA""]","[""Culiac치n, Sinaloa""]","[]","{""1"": ""80027""}","Culiac치n Rosales,  Sinaloa,  M칠xico","[{""Nombre"": ""Antonio E Avil칠s Flores"", ""Cargo"": ""mantenimiento en gasolineras paba"", ""Foto"": ""https://media.licdn.com/dms/image/v2/C5603AQEUvfab8oSbmw/profile-displayphoto-shrink_100_100/profile-displayphoto-shrink_100_100/0/1602621798114?e=2147483647&v=beta&t=bE12Q4pRP6Ytxx3P1_yEXMPWqzWp-HJJDaLqCsE-AKc"", ""Perfil"": ""https://mx.linkedin.com/in/antonio-e-avil%C3%A9s-flores-1728331b9?trk=org-employees""}, {""Nombre"": ""Javier Bon Mart칤nez"", ""Cargo"": ""Gerente de Estaciones (Gasolineras)"", ""Foto"": ""https://media.licdn.com/dms/image/v2/D4D03AQFYBDqrJWRCZg/profile-displayphoto-shrink_100_100/profile-displayphoto-shrink_100_100/0/1681943207598?e=2147483647&v=beta&t=0S4XPSCCmNH8e_Pgt7-UHTEsyCie9denzeTeTt8_aho"", ""Perfil"": ""https://mx.linkedin.com/in/javier-bon-mart%C3%ADnez-0b6278273?trk=org-employees""}, {""Nombre"": ""Antonio Mena"", ""Cargo"": ""Gerencia Comercial en Gasolineras PABA"", ""Foto"": ""https://media.licdn.com/dms/image/v2/D4E03AQEtRa92v8xh3g/profile-displayphoto-shrink_100_100/profile-displayphoto-shrink_100_100/0/1693011871110?e=2147483647&v=beta&t=VtZJW8qlbv9K3Cqvk1UGxwdx16R68HCiWvg1jIFKTB8"", ""Perfil"": ""https://mx.linkedin.com/in/antonio-mena-915885289?trk=org-employees""}]","https://www.linkedin.com/company/gasolineras-paba/"
33167,"Mayork","MayorK춽 es una empresa l칤der en la fabricaci칩n y comercializaci칩n de playeras, con la mayor calidad del mercado por m치s de 20 a침os. Ofrecemos atenci칩n personalizada y venta a mayoreo y menudeo. Actualmente estamos dentro del mercado con 4 tiendas propias en Guadalajara, Culiac치n, Puerto Vallarta y M칠rida; adem치s de 27 distribuidores alrededor de toda la rep칰blica. Contamos con m치s de 200 personas en nuestra l칤nea de producci칩n y 70 personas en el 치rea comercial.",,"51-200 employees","{""1"": {""Direcci칩n"": ""Av. M칠xico 2494, Ladr칩n de Guevara, 2494, Guadalajara, Jal. 44600, MX""}, ""2"": {""Direcci칩n"": ""Berl칤n 126, La Vena, 126, Puerto Vallarta, Jalisco 48320, MX""}, ""3"": {""Direcci칩n"": ""Fray Servando Teresa de Mier, 2051-A, Culiac치n, Sinaloa 80000, MX""}, ""4"": {""Direcci칩n"": ""Cto. Colonias, Pedregales de Tanlum, 312, M칠rida, Yucat치n 97210, MX""}}","1997","[""Textile Manufacturing""]","[""www.mayork.com.mx\n      \n\nExternal link for Mayork""]","[""Guadalajara, Jal.""]","[""Playeras premium"","" Prendas premium"","" Playeras calidad premium"","" Playera tipo polo "","" Playera cuello redondo "","" Sudadera sustentable "","" Moda"","" Uniformes"","" Mayoreo "","" Menudeo "","" Prendas decoradas "","" Uniformes personalizados"","" and Distribuci칩n de playeras premium""]","{""1"": ""44600"", ""2"": ""48320"", ""3"": ""80000"", ""4"": ""97210""}","Culiac치n Rosales,  Sinaloa,  M칠xico","[{""Nombre"": ""Mayork Kids"", ""Cargo"": ""President en Mayork"", ""Foto"": ""https://media.licdn.com/dms/image/v2/C4D03AQEm5QYf_2K-Xg/profile-displayphoto-shrink_100_100/profile-displayphoto-shrink_100_100/0/1517519508848?e=2147483647&v=beta&t=Xpv-nx-_kpA7rInhir-8TyOMSgwj1XD5gDnFgHSb1oE"", ""Perfil"": ""https://co.linkedin.com/in/mayork-kids-4066b6138?trk=org-employees""}, {""Nombre"": ""pablo miz"", ""Cargo"": ""bordador en Mayork"", ""Foto"": ""https://media.licdn.com/dms/image/v2/C4D03AQEvOtT3zzqLgQ/profile-displayphoto-shrink_100_100/profile-displayphoto-shrink_100_100/0/1599592920688?e=2147483647&v=beta&t=qLfViz7ekG5idBSET7ldNfLfwuenzYkcNY1ig6IKIcM"", ""Perfil"": ""https://mx.linkedin.com/in/pablo-miz-969a571b5?trk=org-employees""}, {""Nombre"": ""Paula Rodr칤guez Ruiz"", ""Cargo"": ""Lic. en Nutrici칩n y Ciencias de los Alimentos y Educadora en Diabetes"", ""Foto"": ""https://media.licdn.com/dms/image/v2/D4E03AQHsJpgG26_paw/profile-displayphoto-shrink_100_100/B4EZXPMSwQHMAU-/0/1742937862497?e=2147483647&v=beta&t=AvSCNtpMQ8TRlE18fHVDf8ez_lZVL5JYuQQyDb2O3ng"", ""Perfil"": ""https://mx.linkedin.com/in/paula-rodr%C3%ADguez-ruiz-b1b006228?trk=org-employees""}, {""Nombre"": ""Abdul Rahman Hassan"", ""Cargo"": ""--"", ""Foto"": ""https://media.licdn.com/dms/image/v2/D4E03AQFShNnjP-687w/profile-displayphoto-shrink_100_100/profile-displayphoto-shrink_100_100/0/1700253349970?e=2147483647&v=beta&t=p975yLZgZF662gWr2uKRto9HZ9--65NjsgsihmCK708"", ""Perfil"": ""https://iq.linkedin.com/in/abdul-rahman-hassan-3002532a0?trk=org-employees""}]","https://www.linkedin.com/company/mayorkmx/"
33168,"CENTROS EDUCATIVOS CUALLI, A.C.","Education Administration Programs",,"51-200 employees","{""1"": {""Direcci칩n"": ""CALLE NINGUNO 2515""}}",,"[""Primary and Secondary Education""]","[""http://www.cualli.edu.mx\n      \n\n\n\nExternal link for CENTROS EDUCATIVOS CUALLI, A.C.""]","[]","[]","{}","Culiac치n Rosales,  Sinaloa,  M칠xico","[{""Nombre"": ""Carlos Gaxiola"", ""Cargo"": ""Artista Pl치stico y Dise침ador Gr치fico"", ""Foto"": ""https://media.licdn.com/dms/image/v2/C4D03AQHeNcankEoj0A/profile-displayphoto-shrink_100_100/profile-displayphoto-shrink_100_100/0/1517549545552?e=2147483647&v=beta&t=YwUf88DEKzTUcEHJjowDzSjpohJBCoVjsG2v9mSStZo"", ""Perfil"": ""https://mx.linkedin.com/in/carlos-gaxiola-8a645129?trk=org-employees""}, {""Nombre"": ""Brenda Zavala"", ""Cargo"": ""Profesor en Centros Educativos Cualli"", ""Foto"": ""https://media.licdn.com/dms/image/v2/C4E03AQFgjfPuYEsBCA/profile-displayphoto-shrink_100_100/profile-displayphoto-shrink_100_100/0/1516772830276?e=2147483647&v=beta&t=lVBYrQnup8cuHF3LOgOLViNv9IIsOFx9uz5j6rdWWRU"", ""Perfil"": ""https://mx.linkedin.com/in/brenda-zavala-536a257a?trk=org-employees""}, {""Nombre"": ""Magda Selene Gaxiola Angulo"", ""Cargo"": ""--"", ""Foto"": ""https://media.licdn.com/dms/image/v2/C5603AQGLE_gT9xqEhw/profile-displayphoto-shrink_100_100/profile-displayphoto-shrink_100_100/0/1558474300834?e=2147483647&v=beta&t=zOKoCguxeKzY4fg_ODys8JLJIEg5H0PmBsg9hpWN31Y"", ""Perfil"": ""https://mx.linkedin.com/in/magda-selene-gaxiola-angulo-82769789?trk=org-employees""}, {""Nombre"": ""virginia valdez valle"", ""Cargo"": ""Directora Academica en Centros Educativos Cualli"", ""Foto"": ""https://media.licdn.com/dms/image/v2/C4E03AQEeh4xM2pIxwg/profile-displayphoto-shrink_100_100/profile-displayphoto-shrink_100_100/0/1517466621448?e=2147483647&v=beta&t=OcEjmtDR6ANrLjKh3LGj_z3du4kgQM6nL0LJTumHI8w"", ""Perfil"": ""https://mx.linkedin.com/in/virginia-valdez-valle-9a0522a7?trk=org-employees""}]","https://www.linkedin.com/company/centros-educativos-cualli-a.c./"
33169,"AK B치sculas","AK B치sculas es una empresa de servicio con 60 a침os de experiencia, especializada en instrumentos para pesar y metrolog칤a, con el personal capacitado y la infraestructura necesaria para lograr la satisfacci칩n de nuestros clientes mediante el compromiso hacia la calidad total.
Adem치s, contamos con la venta de instrumentos de pesaje, desde microbalanzas hasta b치sculas de alto alcance, como lo son las b치sculas para cami칩n o ferrocarril, as칤 como el desarrollo de proyectos a la medida de sus necesidades. Contando con alcance nacional gracias a nuestros once puntos de venta en la Rep칰blica Mexicana.",,"51-200 employees","{""1"": {""Direcci칩n"": ""Calle Josefina Haro 320, Insurgentes Oeste, Baja California 21280, MX""}, ""2"": {""Direcci칩n"": ""Calle Gobernador Alfonso Gracia Gonzales #121, Ex-ejido Coahuila, Mexicali, Baja California 21360, MX""}, ""3"": {""Direcci칩n"": ""A.V. Guillermo Prieto #3306 Esq. Gracia Gonzalez. Fracc. Cubillas, Tijuana, Baja California 22045, MX""}, ""4"": {""Direcci칩n"": ""Blvd. Jes칰s Garc칤a Morales 278, El Llano, Hermosillo, Sonora 83210, MX""}, ""5"": {""Direcci칩n"": ""A.V, Vialidad Ch-P 2718, Col. El M치rmol, M치rmol Viejo, Chihuahua, Chihuahua 31063, MX""}, ""6"": {""Direcci칩n"": ""Nte. 81 214, entre Heliopolis y Nilo, Claveria, Azcapotzalco, CDMX, Ciudad de M칠xico 02080, MX""}, ""7"": {""Direcci칩n"": ""Carretera Federal Xalapa Veracruz, Km. 140 s/n Col. Amapolas, Veracruz, Veracruz 91775, MX""}, ""8"": {""Direcci칩n"": ""Av Gral Ignacio Aldama 267, Miguel Alem치n, Culiac치n, Sinaloa 80200, MX""}, ""9"": {""Direcci칩n"": ""C. H칠rcules 109, Nueva Libertad, Guadalupe, Nuevo Le칩n 67120, MX""}, ""10"": {""Direcci칩n"": ""Quer칠taro, Quer칠taro, MX""}, ""11"": {""Direcci칩n"": ""M칠rida, Yucat치n, MX""}, ""12"": {""Direcci칩n"": ""Los Mochis, Sinaloa, MX""}}",,"[""Machinery Manufacturing""]","[""https://akbasculas.com/\n      \n\nExternal link for AK B치sculas""]","[""Insurgentes Oeste, Baja California""]","[""Calibraci칩n de equipos de pesaje"","" Venta de equipos de pesaje"","" Reparaci칩n de equipos de pesaje"","" Automatizaci칩n"","" Proyectos especiales de pesaje"","" Mantenimiento"","" ajuste y diagn칩stico"","" Calibraci칩n Oficial"","" Programaci칩n"","" Accesorios y refacciones"","" Calibraci칩n de Objetos S칩lidos No Normalizados"","" Calibraci칩n Oficial"","" Inspecci칩n PROFECO"","" P칩lizas de servicio"","" Venta de pesas patr칩n"","" Calibraci칩n de pesas patr칩n"","" Sistemas"","" Renta"","" Alto Alcance"","" Bajo Alcance"","" and Mediano Alcance""]","{""1"": ""21280"", ""2"": ""21360"", ""3"": ""22045"", ""4"": ""83210"", ""5"": ""31063"", ""6"": ""02080"", ""7"": ""91775"", ""8"": ""80200"", ""9"": ""67120""}","Culiac치n Rosales,  Sinaloa,  M칠xico","[{""Nombre"": ""Jose A. Alvarez Jim칠nez."", ""Cargo"": ""Ingenier칤a industrial y de Sistemas"", ""Foto"": ""https://media.licdn.com/dms/image/v2/C4D03AQE0WTCU4sMnIQ/profile-displayphoto-shrink_100_100/profile-displayphoto-shrink_100_100/0/1516783073000?e=2147483647&v=beta&t=U1c-9eHkg7DiBdXZjLS4LRAEQoauEvLTEEXVjpABroE"", ""Perfil"": ""https://mx.linkedin.com/in/jose-a-alvarez-jim%C3%A9nez-64144418?trk=org-employees""}, {""Nombre"": ""Alexia Hernandez"", ""Cargo"": ""Encargada de Remisiones en Ak Basculas"", ""Foto"": ""https://media.licdn.com/dms/image/v2/C4E03AQH2RqQojLq4Mw/profile-displayphoto-shrink_100_100/profile-displayphoto-shrink_100_100/0/1516493383101?e=2147483647&v=beta&t=DM1YlesuMq2PbE2Y14-i1tW1PMASV5GvY1dvoDZsScs"", ""Perfil"": ""https://mx.linkedin.com/in/alexia-hernandez-87045473?trk=org-employees""}, {""Nombre"": ""AK B치sculas"", ""Cargo"": ""Sales And Marketing Specialist at AK B치sculas"", ""Foto"": ""https://media.licdn.com/dms/image/v2/C5603AQGYH-wCIcw4BA/profile-displayphoto-shrink_100_100/profile-displayphoto-shrink_100_100/0/1564853161598?e=2147483647&v=beta&t=fDGWYcf1Ry-PWhWGKKHcNFET3bfZWMpLlMNI_n_ockU"", ""Perfil"": ""https://mx.linkedin.com/in/ak-b%C3%A1sculas-092b7a189?trk=org-employees""}, {""Nombre"": ""Joshua Abisai Calderon Pacheco"", ""Cargo"": ""Estudiante (Contador P칰blico)"", ""Foto"": ""https://media.licdn.com/dms/image/v2/C5603AQFvjGfWAxOs3Q/profile-displayphoto-shrink_100_100/profile-displayphoto-shrink_100_100/0/1574804760075?e=2147483647&v=beta&t=Be0T5tdGxvawg_AhNkAYyX7Xl4oVl3QVcOyZenIzvzc"", ""Perfil"": ""https://mx.linkedin.com/in/joshua-abisai-calderon-pacheco-869a69196?trk=org-employees""}]","https://www.linkedin.com/company/ak-b%C3%A1sculas/"
33170,"GASTELUM Y GASTELUM","Wholesale Building Materials",,"51-200 employees","{""1"": {""Direcci칩n"": ""BOULEVARD EMILIANO ZAPATA 5305""}}",,"[""Consumer Electronics""]","[]","[]","[]","{}","Culiac치n Rosales,  Sinaloa,  M칠xico","[{""Nombre"": ""Alejandro Hern치ndez L칩pez"", ""Cargo"": ""Automatizaci칩n y Control en Gastelum y Gastelum Electricidad, s. a. de c. v."", ""Foto"": ""https://media.licdn.com/dms/image/v2/C4E03AQGU-4RDCCszxw/profile-displayphoto-shrink_100_100/profile-displayphoto-shrink_100_100/0/1547500202209?e=2147483647&v=beta&t=IpoER1xxbDWEpQOF7XtSQNnT21Vz2BRo8wBRBCBF6IE"", ""Perfil"": ""https://mx.linkedin.com/in/alejandro-hern%C3%A1ndez-l%C3%B3pez-a1058371?trk=org-employees""}, {""Nombre"": ""luis anguli"", ""Cargo"": ""Soporte tecnico en Gastelum y gastelum"", ""Foto"": ""https://media.licdn.com/dms/image/v2/C5603AQGxEXLdjdwQOg/profile-displayphoto-shrink_100_100/profile-displayphoto-shrink_100_100/0/1516862459327?e=2147483647&v=beta&t=Z9Qa-YSuO0OybIF_oW5GoCDJAoxI7ezz00DXDWmp4To"", ""Perfil"": ""https://mx.linkedin.com/in/luis-anguli-450221b8?trk=org-employees""}, {""Nombre"": ""RECKER RAMIREZ"", ""Cargo"": ""Ingeniero electr칩nico superior en servicios electricos industriales y navales de mazatlan"", ""Foto"": ""https://media.licdn.com/dms/image/v2/C4E03AQF5BstSFxOZ0A/profile-displayphoto-shrink_100_100/profile-displayphoto-shrink_100_100/0/1634054363054?e=2147483647&v=beta&t=4QnRsa3anv9O826mS4M4HKUEKpA5aumaZsY2icPqYhU"", ""Perfil"": ""https://mx.linkedin.com/in/recker-ramirez-4aa538129?trk=org-employees""}, {""Nombre"": ""Gildardo Alan Camacho Gastelum"", ""Cargo"": ""Ing El칠ctrico"", ""Foto"": ""https://media.licdn.com/dms/image/v2/C5103AQFX5SzXAjBQHg/profile-displayphoto-shrink_100_100/profile-displayphoto-shrink_100_100/0/1517996508500?e=2147483647&v=beta&t=mg_F256BJs8UzYktzl9FEVnVAd4FqFFwPyKj5-XRfGk"", ""Perfil"": ""https://mx.linkedin.com/in/gildardo-alan-camacho-gastelum-02ab08143?trk=org-employees""}]","https://www.linkedin.com/company/gastelum-y-gastelum/"
33171,"COWORKING 120","Nos dedicamos a brindar una soluci칩n a los empresarios en la  b칰squeda y cambio de oficinas ofreciendo espacios en renta completamente equipados con todos los servicios incluidos / We are dedicated to providing a solution to large companies and entrepreneurs in the search and change of offices offering spaces for rent fully equipped with all services included.",,"51-200 employees","{""1"": {""Direcci칩n"": ""Desarrollo Urbano Tres R칤os, Corporativo 120, Culiac치n, Sinaloa  80020, MX""}, ""2"": {""Direcci칩n"": ""Calle Miguel Alem치n #2678 Colonia Am칠rica, Tijuana, Baja California 22044, MX""}, ""3"": {""Direcci칩n"": ""Bulevar Morelos, Colonia Zona Militar, Edificio H, Hermosillo, Sonora 83145, MX""}}","2014","[""Leasing Non-residential Real Estate""]","[""http://coworking120.com/\n      \n\nExternal link for COWORKING 120""]","[""Culiac치n, Sinaloa""]","[]","{""1"": ""80020"", ""2"": ""22044"", ""3"": ""83145""}","Culiac치n Rosales,  Sinaloa,  M칠xico","[{""Nombre"": ""Melissa Rangel"", ""Cargo"": ""Recepcionista en COWORKING 120"", ""Foto"": ""https://media.licdn.com/dms/image/v2/D5603AQGA7p8OBSdGPQ/profile-displayphoto-shrink_100_100/profile-displayphoto-shrink_100_100/0/1727896264418?e=2147483647&v=beta&t=NnlWGbPDdzwDV9VMUrbDm1XpE5sQBIYBSBjeqlSz_4Y"", ""Perfil"": ""https://mx.linkedin.com/in/melissa-rangel-85b372279?trk=org-employees""}, {""Nombre"": ""Paola Fernandez"", ""Cargo"": ""Gerente comercial en COWORKING 120"", ""Foto"": ""https://media.licdn.com/dms/image/v2/D4E03AQGF6Vl0t2PEZA/profile-displayphoto-shrink_100_100/profile-displayphoto-shrink_100_100/0/1720633475848?e=2147483647&v=beta&t=dhg9hwGnBgpiUslax2xPOBatfaqTgEykdqa1Q773JrU"", ""Perfil"": ""https://mx.linkedin.com/in/paola-fernandez-962087313?trk=org-employees""}]","https://www.linkedin.com/company/coworking-120/"
33172,"Mega Concreto y Block","Actualmente MEGA Concreto | Block se especializa en la producci칩n y distribuci칩n de productos vibro comprimidos, agregados p칠treos y concreto premezclado con calidad profesional certificada fundamentando su oferta empresarial en la amplia trayectoria y participaci칩n de nuestra marca en obras de gran importancia y alto volumen.",,"51-200 employees","{""1"": {""Direcci칩n"": ""Blvd. Rosales #227 Nte., colonia Scally, Los Mochis, Sinaloa 81240, MX""}, ""2"": {""Direcci칩n"": ""Carretera Mochis-Ahome Km. 7.0 S/N, ejido Mochis, Los Mochis, Sinaloa 81360, MX""}, ""3"": {""Direcci칩n"": ""Carretera Mochis-El Fuerte Km. 5.0 S/N, ejido 5 de Mayo, Los Mochis, Sinaloa 81361, MX""}, ""4"": {""Direcci칩n"": ""Carretera Le칩n Fonseca, ejido Las Palmitas, Guasave, Sinaloa 81103, MX""}, ""5"": {""Direcci칩n"": ""Blvd. Juan M. Zambada #5900, colonia Las Flores, Culiac치n, Sinaloa 80104, MX""}, ""6"": {""Direcci칩n"": ""Rancho Los Cano, Av. Paseo del Pac칤fico, poblado El Venadillo, Mazatl치n, Sinaloa 82129, MX""}}",,"[""Construction""]","[""http://www.megablock.com.mx\n      \n\nExternal link for Mega Concreto y Block""]","[""Los Mochis, Sinaloa""]","[""Concreto premezclado"","" Block"","" Tabique"","" Adoqu칤n"","" Agregados"","" and Material petreo""]","{""1"": ""81240"", ""2"": ""81360"", ""3"": ""81361"", ""4"": ""81103"", ""5"": ""80104"", ""6"": ""82129""}","Culiac치n Rosales,  Sinaloa,  M칠xico","[{""Nombre"": ""Arq. Raul Ruiz Lopez"", ""Cargo"": ""Gerente de Plaza en MEGABLOCK"", ""Foto"": ""https://media.licdn.com/dms/image/v2/C5603AQGm0nucjyLm0g/profile-displayphoto-shrink_100_100/profile-displayphoto-shrink_100_100/0/1564769569618?e=2147483647&v=beta&t=MvZcFkUnRCej_El0Lkqq5E_4moOqFCY0jAN8THFJl-o"", ""Perfil"": ""https://mx.linkedin.com/in/arq-raul-ruiz-lopez-2b407340?trk=org-employees""}, {""Nombre"": ""Jose David Rochin"", ""Cargo"": ""Gerente de organiza칞칚o en Mega Concreto y Block"", ""Foto"": ""https://media.licdn.com/dms/image/v2/C5603AQFJfsvZSo5YKA/profile-displayphoto-shrink_100_100/profile-displayphoto-shrink_100_100/0/1564189559041?e=2147483647&v=beta&t=ujKOHRXf-wLDIeR3hNRjulw0PTj3OIXdXW5M4LZD0Wc"", ""Perfil"": ""https://mx.linkedin.com/in/jose-david-rochin-a5892763?trk=org-employees""}, {""Nombre"": ""Erik Torre Roque"", ""Cargo"": ""Ingeniero de producci칩n en MEGA CONCRETO SAC"", ""Foto"": ""https://media.licdn.com/dms/image/v2/C4E03AQFsjMv7h100vw/profile-displayphoto-shrink_100_100/profile-displayphoto-shrink_100_100/0/1517262337814?e=2147483647&v=beta&t=2EyOlXUhGiwSxDDO4CLLKUw2zNfiE1Kze_dDxxU1Gos"", ""Perfil"": ""https://pe.linkedin.com/in/erik-torre-roque-2551168a?trk=org-employees""}, {""Nombre"": ""Fanny Casta침eda"", ""Cargo"": ""Auxiliar contable en Mega Concreto y Block"", ""Foto"": ""https://media.licdn.com/dms/image/v2/D4E03AQEIfxXOCWctpg/profile-displayphoto-shrink_100_100/profile-displayphoto-shrink_100_100/0/1672692482756?e=2147483647&v=beta&t=eIZ29tjwhxWC4S2aNTs9tZOiLTNZCrupY0mZC0v0cTc"", ""Perfil"": ""https://mx.linkedin.com/in/fanny-casta%C3%B1eda-386423260?trk=org-employees""}]","https://www.linkedin.com/company/mega-concreto-y-block/"
33173,"Aji Restaurant Group","Grupo Aj칤 es un grupo restaurantero originario de Culiac치n, Sinaloa.
Est치 conformado por los restaurantes Aj칤 China Bistro, Asian Jungle y La Maquila. Todos en la ciudad de Culiac치n.",,"51-200 employees","{""1"": {""Direcci칩n"": ""Culiacan, Sinaloa 80060, MX""}, ""2"": {""Direcci칩n"": ""BOULEVARD EL DORADO 1641""}}","2002","[""Restaurants""]","[""http://www.ajichinabistro.com\n      \n\nExternal link for Aji Restaurant Group""]","[""Culiacan, Sinaloa""]","[]","{""1"": ""80060""}","Culiac치n Rosales,  Sinaloa,  M칠xico","null","https://www.linkedin.com/company/restaurante-aji-china-bistro/"
33174,"San Felipe y Santiago Construcciones SA de CV","Ubicados en Culiac치n Sinaloa, San Felipe y Santiago Construcciones S.A. de C.V. es una empresa enfocada en la industria de la construcci칩n con 15 a침os de servicio, respaldados por nuestros clientes que garantizan la calidad, tiempo y costo de nuestro trabajo.",,"51-200 employees","{""1"": {""Direcci칩n"": ""Calle Puerto de Huatabampo, 2295-B, El Vallado, Sinaloa 80110, MX""}}","2006","[""Construction""]","[""http://sanfelipeysantiagoconstrucciones.com.mx\n      \n\nExternal link for San Felipe y Santiago Construcciones SA de CV""]","[""El Vallado, Sinaloa""]","[]","{""1"": ""80110""}","Culiac치n Rosales,  Sinaloa,  M칠xico","[{""Nombre"": ""Manuel Roberto Bajo Rodriguez"", ""Cargo"": ""Director de San Felipe y Santiago Construcciones SA de CV"", ""Foto"": ""https://media.licdn.com/dms/image/v2/C5603AQGXCs0KffzEUw/profile-displayphoto-shrink_100_100/profile-displayphoto-shrink_100_100/0/1610511568179?e=2147483647&v=beta&t=Xafmy9bGXkAfQRX6IRZdhE6t9uvqQPHXSsLx-CYgVIs"", ""Perfil"": ""https://mx.linkedin.com/in/manuel-roberto-bajo-rodriguez-0a5440a5?trk=org-employees""}, {""Nombre"": ""Itzel Sarahi Bajo Heredia"", ""Cargo"": ""Biobusinees Engineering"", ""Foto"": ""https://media.licdn.com/dms/image/v2/D5603AQG5tJwlxxRoeQ/profile-displayphoto-shrink_100_100/profile-displayphoto-shrink_100_100/0/1710361586551?e=2147483647&v=beta&t=MzpayJzjxNPy3pZGJKEzhmPAlpA0Xby0LMfR5-CmUFg"", ""Perfil"": ""https://mx.linkedin.com/in/itzelbajo?trk=org-employees""}, {""Nombre"": ""Francisco Erenas"", ""Cargo"": ""Lic. en Ingenieria Civil en San Felipe y Santiago Construcciones SA de CV"", ""Foto"": ""https://media.licdn.com/dms/image/v2/C4E03AQENRRAaJ5g6mg/profile-displayphoto-shrink_100_100/profile-displayphoto-shrink_100_100/0/1611765649510?e=2147483647&v=beta&t=F-MJs7aQ-bS_YAFB4TIay3crJyVysNaLy8DwikYDFd8"", ""Perfil"": ""https://mx.linkedin.com/in/francisco-erenas-200038205?trk=org-employees""}, {""Nombre"": ""Ana Paola Padilla Quintero"", ""Cargo"": ""--"", ""Foto"": ""https://media.licdn.com/dms/image/v2/D4E03AQHiw295GAop4w/profile-displayphoto-shrink_100_100/profile-displayphoto-shrink_100_100/0/1703044366319?e=2147483647&v=beta&t=x8h4-Pb44Xh8pjWesXY1QRJO7DKuDprjXHL3SZ5Dt7c"", ""Perfil"": ""https://mx.linkedin.com/in/ana-paola-padilla-quintero-a46633205?trk=org-employees""}]","https://www.linkedin.com/company/san-felipe-y-santiago-construcciones-sa-de-cv/"
33175,"Espinoza Higuera Constructores S.A. de C.V.","Empresa Sinaloense dedicada  a la construcci칩n con alta experiencia en la edificaci칩n de obrasindustriales, comerciales y p칰blicas.
Admas de supervisi칩n, verificaci칩n y direcci칩n.",,"51-200 employees","{""1"": {""Direcci칩n"": ""Indio de Guelatao #30 Col Miguel Hidalgo, Int. 103, Culiac치n, Sinaloa 80090, MX""}}",,"[""Construction""]","[""http://www.ehcoconstructores.com\n      \n\nExternal link for Espinoza Higuera Constructores S.A. de C.V.""]","[""Culiac치n, Sinaloa""]","[]","{""1"": ""80090""}","Culiac치n Rosales,  Sinaloa,  M칠xico","[{""Nombre"": ""Fernanda Navarro"", ""Cargo"": ""Bi칩logo"", ""Foto"": ""https://media.licdn.com/dms/image/v2/D4E03AQGGy6xhYm7O2w/profile-displayphoto-shrink_100_100/profile-displayphoto-shrink_100_100/0/1704730219356?e=2147483647&v=beta&t=MWV2PRe389BBMSNrdh70Ve54mQalWDcAcquFgusj6FM"", ""Perfil"": ""https://mx.linkedin.com/in/fernanda-navarro-a31a71166?trk=org-employees""}, {""Nombre"": ""Javier Antemio Higuera Molina"", ""Cargo"": ""Arquitecto en Espinoza Higuera Constructores S.A. de C.V."", ""Foto"": ""https://media.licdn.com/dms/image/v2/C5603AQHGphJR-DAkbg/profile-displayphoto-shrink_100_100/profile-displayphoto-shrink_100_100/0/1600627072504?e=2147483647&v=beta&t=khC2flGIPsJdowXCvcekKSFFxjxzIzg1_K8E54XGEVc"", ""Perfil"": ""https://mx.linkedin.com/in/javier-antemio-higuera-molina-32b830191?trk=org-employees""}, {""Nombre"": ""Magda Yamil Gutierrez Vargas"", ""Cargo"": ""Auxiliar administrativo en Espinoza Higuera Constructores S.A. de C.V."", ""Foto"": ""https://media.licdn.com/dms/image/v2/D4D03AQHH2jK5O3rfkg/profile-displayphoto-shrink_100_100/profile-displayphoto-shrink_100_100/0/1672675859810?e=2147483647&v=beta&t=X00esZ5NY1NUTXLDwuD3Zrj5nwHJn2QdwxrOqoE7irs"", ""Perfil"": ""https://mx.linkedin.com/in/magda-yamil-gutierrez-vargas-3a8581260?trk=org-employees""}]","https://www.linkedin.com/company/ehcoconstructores/"
