"id","nombre","resumen","telefono","tamano","ubicaciones","fundacion","sector","sitio_web","sede","especialidades","codigo_postal","ciudad","empleados","url"
33198,"KoiReader Technologies","KoiReader Technologies is a pioneer and global leader in Vision and Generative Al-powered Logistics, Supply Chain, and Industrial Automation solutions, and recognized in the industry for its KoiVision춽 Digital Operations Platform and Al Operating Model.

As AI projects continue to fail to deliver value globally for lack of accuracy, lack of value, and complexity of integration, industry leaders such as NVIDIA and PepsiCo have endorsed KoiVision춽 Platform for its offerings that include Warehouse, Yard, and Manufacturing Intelligence.",,"51-200 employees","{}","2019","[""Transportation"","" Logistics"","" Supply Chain and Storage""]","[""https://www.koireader.com\n      \n\nExternal link for KoiReader Technologies""]","[""Dallas, Texas""]","[""Logistics"","" Artificial Intelligence"","" Computer Vision"","" Transportation"","" FreightTech"","" Image Processing"","" Multimodal Transportation"","" Warehouse Automation"","" Yard Automation"","" Port Automation"","" Factory Automation"","" Enterprise AI"","" Industrial Automation"","" and Manufacturing Automation""]","{}","Aguascalientes,  Aguascalientes,  M칠xico","null","https://www.linkedin.com/company/koireader/"
33199,"IT-SEEKERS","Somos un equipo de expertos con m치s de 13 a침os de experiencia en el sector tecnol칩gico.

Nuestro equipo incluye desarrolladores, testers, personal de soporte y reclutadores de TI altamente capacitados, listos para ayudarte a superar cualquier desaf칤o tecnol칩gico y llevar tu empresa al siguiente nivel.

Cont치ctanos hoy mismo y comienza la transformaci칩n digital que tu negocio necesita.",,"51-200 employees","{""1"": {""Direcci칩n"": ""Av. Universidad 1001 Piso 4 Oficinas 9,10 y 11 Col. Bosques del Prado Aguascalientes, 20130, Aguascalientes, Aguascalientes 20120, MX""}, ""2"": {""Direcci칩n"": ""CDMX, Ciudad de M칠xico 03800, MX""}, ""3"": {""Direcci칩n"": ""Zapopan, Jalisco 45116, MX""}, ""4"": {""Direcci칩n"": ""Houston, Texas 77092, US""}}","2011","[""IT Services and IT Consulting""]","[""http://www.it-seekers.com\n      \n\nExternal link for IT-SEEKERS""]","[""Aguascalientes, Aguascalientes""]","[""desarrollo de software"","" atraccion de talento tecnol칩gico"","" mantenimiento de aplicaciones digitales"","" soporte t칠cnico digital"","" empresas inteligentes"","" SAP"","" and transformaci칩n y migraci칩n digital""]","{""1"": ""20130"", ""2"": ""03800"", ""3"": ""45116"", ""4"": ""77092""}","Aguascalientes,  Aguascalientes,  M칠xico","[{""Nombre"": ""Aristeo Campuzano Granados"", ""Cargo"": ""Consultor T칠cnico EBS - Oracle en IT-Seekers"", ""Foto"": ""https://media.licdn.com/dms/image/v2/C4E03AQGzrmnSSfqrMA/profile-displayphoto-shrink_100_100/profile-displayphoto-shrink_100_100/0/1651623831374?e=2147483647&v=beta&t=vDdZHTtCqCciyxEu5DFDVMwm8jT-pYnEi4OwfAjEc5M"", ""Perfil"": ""https://mx.linkedin.com/in/aristeo-campuzano?trk=org-employees""}, {""Nombre"": ""Ithamar Caballero"", ""Cargo"": ""D-1, PMP, CSM, MBA"", ""Foto"": ""https://media.licdn.com/dms/image/v2/C4E03AQF86FFTr1YCvw/profile-displayphoto-shrink_100_100/profile-displayphoto-shrink_100_100/0/1641401054702?e=2147483647&v=beta&t=JRNBbLYZXgS_fujVuOCnBWdiF3CZhlIoj066iAvD45Q"", ""Perfil"": ""https://mx.linkedin.com/in/ithamarcaballero/en?trk=org-employees""}, {""Nombre"": ""Juventino Saucedo"", ""Cargo"": ""Empowering organizations to build and enhance their digital experience | Business Development Executive | Investment promoter | Delivery Manager |"", ""Foto"": ""https://media.licdn.com/dms/image/v2/D4E03AQG07c0OvhLuJg/profile-displayphoto-shrink_100_100/profile-displayphoto-shrink_100_100/0/1725989615840?e=2147483647&v=beta&t=ynxI_D3Cwkvzu1wMnxd-CvtKOkJcF29tPY_vyOSdGYk"", ""Perfil"": ""https://mx.linkedin.com/in/juventino-saucedo-78391328?trk=org-employees""}, {""Nombre"": ""Oscar Cea Cort칠s"", ""Cargo"": ""TI Aplicaciones Administrativas en IT-SEEKERS"", ""Foto"": ""https://media.licdn.com/dms/image/v2/C5603AQHuqzyR7bWevw/profile-displayphoto-shrink_100_100/profile-displayphoto-shrink_100_100/0/1622481274118?e=2147483647&v=beta&t=t5TqPbz7I7DykzKzQvnUuizUvxdMHKnoh9JrXhaIYMI"", ""Perfil"": ""https://mx.linkedin.com/in/oscar-cea-cort%C3%A9s-55740129?trk=org-employees""}]","https://www.linkedin.com/company/it-seekers/"
33200,"Sea Cargo Logistics","Somos agente de carga, l칤der en Latinoam칠rica, contamos con 30 a침os de experiencia como integradores de servicios de flete internacional, mar칤timo, a칠reo, terrestre y multimodal (combinaci칩n de cualquiera de los anteriores).
 
Tenemos 16 oficinas en M칠xico, Colombia, Per칰, Costa Rica y Panam치. Ofrecemos las opciones m치s atractivas para importaci칩n y exportaci칩n de mercanc칤as.

Nuestros principales objetivos son:

- Asesorarte en todo tu proceso log칤stico para que tu carga llegue segura de origen a destino final. (Puerta a puerta)
- Comunicaci칩n continua siempre por parte de un humano.
- Contamos con un equipo especializado, asignado para cada proyecto, el cual conocer치s desde el primer contacto.
- Nos especializamos en minimizar los tiempos de tr치nsito y optimizar el presupuesto de tus embarques a trav칠s del an치lisis de la mejor propuesta para tus necesidades de carga.
- Nuestras principales rutas comerciales son: Colombia, Costa Rica, Per칰, Panam치, Italia, Espa침a, Alemania y China.
- Las industrias en las que somos expertos son: Automotriz, Construcci칩n, Perecederos, Industrial, Energ칠tica, Retail y Carga Proyecto (pesada y sobredimiensionada.",,"51-200 employees","{""1"": {""Direcci칩n"": ""Calle Leibnitz 117, Oficina 401, Miguel Hidalgo, Mexico City 11590, MX""}, ""2"": {""Direcci칩n"": ""Avenida Carbonel 4909 3er piso, Col. Panamericana, Chihuahua, Chihuahua 31203, MX""}, ""3"": {""Direcci칩n"": ""Av. del Altillo 220-9 Bodega 23, Col. Villa de San Miguel, Guadalupe, Nuevo Leon 67110, MX""}, ""4"": {""Direcci칩n"": ""Av. Ni침os Heroes 2905-1, Col. Jardines del Bosque, Guadalajara, Jalisco 44520, MX""}, ""5"": {""Direcci칩n"": ""Boulevard Hacienda del Jacal 422, Col. Jardines de la Hacienda, Jardines de la Hacienda, Quer칠taro Arteaga 76180, MX""}, ""6"": {""Direcci칩n"": ""Torre Natyvo, Blvd. de Los Reyes N춿6431, Piso 9, 907, San Bernardino, Tlaxcalancingo, San Andr칠s Cholula, Puebla 72820, MX""}, ""7"": {""Direcci칩n"": ""Av. Capit치n Carlos Le칩n S/N, Pe침칩n de los Ba침os, Venustiano Carranza, CDMX 15620, MX""}, ""8"": {""Direcci칩n"": ""Edif. Grupo Financiero Inbursa, Av. Las Am칠ricas N춿110, Oficina 101, Col. La Fuente, Aguascalientes 20239, MX""}, ""9"": {""Direcci칩n"": ""Blvd.Teniente J.Azueta 130-214, Recinto Portuario, Ensenada, Baja California 22830, MX""}, ""10"": {""Direcci칩n"": ""Calle 22, N춿40, Local 23 y 24, Col. San Antonio Cinta, M칠rida, Yucat치n 97139, MX""}, ""11"": {""Direcci칩n"": ""Blvd. San Pedro, 245, Paseo de los Colibries, Colonia San Isidro, Le칩n Guanajuato 37510, MX""}, ""12"": {""Direcci칩n"": ""Av. Sierra Leona 360 Piso 9, Oficina 948, Villantigua, San Luis Potos칤 78214, MX""}, ""13"": {""Direcci칩n"": ""Jr. Dominguez No.105, Oficina 501, San Borja, Lima, PE""}, ""14"": {""Direcci칩n"": ""Calle 12 No. 43D - 67, Int. 201, Barrio Manila, Medellin Antoquia, CO""}, ""15"": {""Direcci칩n"": ""R칤o Segundo de Alajuela 200 mts. al Norte del Hotel Holliday Inn, Oficentro Santa Mar칤a Oficina 4 A, Costa Rica, San Jos칠, CR""}, ""16"": {""Direcci칩n"": ""Edificio Obarrio 60, Oficina 8F, Calle 60, Este  Obarrio, Panam치 0832-0588, PA""}}","2009","[""Transportation"","" Logistics"","" Supply Chain and Storage""]","[""https://seacargo.com?utm_source=linkedin&utm_medium=social&utm_campaign=pagprincipallinkedin&utm_id=pagprincipal&utm_content=infolinkedin\n      \n\nExternal link for Sea Cargo Logistics""]","[""Miguel Hidalgo, Mexico City""]","[""International Transport"","" Logistics"","" Distribution"","" Industrial Cargo Projects"","" Transporte de Mercanc칤as"","" Agente de carga"","" Transporte A칠reo"","" Transporte Terrestre"","" Carga Proyecto"","" Importaci칩n"","" Exportaci칩n"","" Carga Internacional"","" Agente Log칤stico"","" Cadena de suministro"","" Log칤stica y distribuci칩n"","" Despacho Aduanal"","" Seguro de Carga"","" Agente Aduanal"","" Transitario"","" Empresa de log칤stica y transporte"","" Transporte Mar칤timo"","" and Comercio internacional""]","{""1"": ""11590"", ""2"": ""31203"", ""3"": ""67110"", ""4"": ""44520"", ""5"": ""76180"", ""6"": ""72820"", ""7"": ""15620"", ""8"": ""20239"", ""9"": ""22830"", ""10"": ""97139"", ""11"": ""37510"", ""12"": ""78214""}","Aguascalientes,  Aguascalientes,  M칠xico","[{""Nombre"": ""Raquel Haj Wong"", ""Cargo"": ""Ocean Freight Director"", ""Foto"": ""https://media.licdn.com/dms/image/v2/D5603AQErbKnpKRaD-A/profile-displayphoto-shrink_100_100/profile-displayphoto-shrink_100_100/0/1732490440005?e=2147483647&v=beta&t=axlnPcPtEw-TMM6GFmqW15LONM-_dL6hSTHNGqzceJM"", ""Perfil"": ""https://mx.linkedin.com/in/raquel-haj-wong?trk=org-employees""}, {""Nombre"": ""Gisela L칩pez"", ""Cargo"": ""Human Resources en Sea Cargo Logistics"", ""Foto"": ""https://media.licdn.com/dms/image/v2/C5603AQElLnPjT-BQeQ/profile-displayphoto-shrink_100_100/profile-displayphoto-shrink_100_100/0/1517766345112?e=2147483647&v=beta&t=W4Y6l6lmB_5DGlEBflIpLcnMEVz7JHGX3DmTazdotrw"", ""Perfil"": ""https://mx.linkedin.com/in/giselalopez?trk=org-employees""}, {""Nombre"": ""Marco Bellisario"", ""Cargo"": ""Manager at Sea Cargo Logistics"", ""Foto"": ""https://media.licdn.com/dms/image/v2/C4D03AQFoQGLQtYZ75g/profile-displayphoto-shrink_100_100/profile-displayphoto-shrink_100_100/0/1516587263890?e=2147483647&v=beta&t=v832XWFgJvHZTfWIHfCfO4bJm6lSf7TTSztCp8csra4"", ""Perfil"": ""https://cr.linkedin.com/in/marcobellisario1980?trk=org-employees""}, {""Nombre"": ""Rafael M."", ""Cargo"": ""Corportate Business Manager Sea Cargo Logistics."", ""Foto"": ""https://media.licdn.com/dms/image/v2/C4D03AQGQY7Nf5Fhosw/profile-displayphoto-shrink_100_100/profile-displayphoto-shrink_100_100/0/1516882563830?e=2147483647&v=beta&t=qNouZuUPU-0NvfKE3e7afirg0-XK92Sjmd8DI1o3cn0"", ""Perfil"": ""https://pe.linkedin.com/in/rafael-m-671aa11b?trk=org-employees""}]","https://www.linkedin.com/company/seacargologistics/"
33201,"Sithec","At Sithec, we specialize in delivering cutting-edge software solutions that drive business transformation and unlock new opportunities. With a team of seasoned developers, creative designers, and forward-thinking strategists, we craft custom applications tailored to meet the unique needs of each client. Our expertise spans a wide range of technologies, including web and mobile development, cloud computing, AI, and data analytics.

We are committed to excellence in everything we do, from initial consultation to post-launch support, ensuring that our solutions are not only technically sound but also align with our clients' business goals. Whether youre a startup looking to disrupt the market or an established enterprise seeking to optimize your operations, Sithec is your trusted partner in innovation.",,"51-200 employees","{""1"": {""Direcci칩n"": ""Paseo Sierra Hermosa, Aguascalientes, 20120, MX""}}","2016","[""Software Development""]","[""https://sithec.com.mx/\n      \n\nExternal link for Sithec""]","[""Aguascalientes""]","[""desarrollo de software"","" contpaqi"","" Software"","" and TI support""]","{""1"": ""20120""}","Aguascalientes,  Aguascalientes,  M칠xico","[{""Nombre"": ""Michael Agustin Keb Pech 游쓇릖"", ""Cargo"": ""Software Developer | React | Angular | Vue | Flutter | React Native | Ionic | Supabase | Laravel | MySQL | GraphQL | NodeJs | Php | Figma | WordPress"", ""Foto"": ""https://media.licdn.com/dms/image/v2/D5603AQGCB6Ow9Th4SQ/profile-displayphoto-shrink_100_100/profile-displayphoto-shrink_100_100/0/1674425847839?e=2147483647&v=beta&t=X_53SoMV7lKScBAAZwejrjjwSadGH64YOrk7AtGUQbw"", ""Perfil"": ""https://mx.linkedin.com/in/michael-keb-pech?trk=org-employees""}, {""Nombre"": ""Hamza BCHAR"", ""Cargo"": ""Projet Manager"", ""Foto"": ""https://media.licdn.com/dms/image/v2/D4E03AQHHZK11akYUPg/profile-displayphoto-shrink_100_100/profile-displayphoto-shrink_100_100/0/1700137509486?e=2147483647&v=beta&t=EDcYjExazWQalWPSBbIoqmu2Rg09xbGo2ozTIw_Kd1Y"", ""Perfil"": ""https://ma.linkedin.com/in/hamza-bchar-5b8aab124?trk=org-employees""}, {""Nombre"": ""Cesar Enrique Nieves Moreno"", ""Cargo"": ""Desarrollador full stack"", ""Foto"": ""https://media.licdn.com/dms/image/v2/D5603AQFOw0GQo0WbCg/profile-displayphoto-shrink_100_100/profile-displayphoto-shrink_100_100/0/1722327916117?e=2147483647&v=beta&t=zTQ7BodOLubGhJy0qSq2PBRtTuqChBFbgthrCbcPWVs"", ""Perfil"": ""https://mx.linkedin.com/in/cesar-enrique-nieves-moreno-368787140?trk=org-employees""}, {""Nombre"": ""Omar Cortes"", ""Cargo"": ""Consultor"", ""Foto"": ""https://media.licdn.com/dms/image/v2/C4E03AQHFMJlQKcfeYQ/profile-displayphoto-shrink_100_100/profile-displayphoto-shrink_100_100/0/1560209442762?e=2147483647&v=beta&t=G4lwW1MvnBfNnO91rlQC8tSP28y9PHxdJWu4ZkVycDQ"", ""Perfil"": ""https://mx.linkedin.com/in/omar-cortes-703a49146?trk=org-employees""}]","https://www.linkedin.com/company/sithec/"
33202,"Karcher Mexico SA de CV","Top-class performance in cleanliness and maintenance of value 
In terms of quality and technology we are the world땁 leading provider of cleaning systems, cleaning products and services for recreation, household, trade and industry. Our products enable our customers to solve their cleaning tasks in an economical and environmentally-friendly manner.",,"51-200 employees","{""1"": {""Direcci칩n"": ""Circuito Poetas 68, Ciudad Sat칠lite, M칠xico 53100, MX""}, ""2"": {""Direcci칩n"": ""Av. Ej칠rcito Nacional 253 A, Col. An치huac, M칠xico D.F., D.F. 11320, MX""}, ""3"": {""Direcci칩n"": ""Av. Circuito Colonias No. 333 por 43-A, Col. Pedregales de Tanlum, M칠rida, Yucat치n 97210, MX""}, ""4"": {""Direcci칩n"": ""Boulevard Aguascalientes Poniente No 2017 Local B, Col. Curtidores, Aguascalientes, Aguascalientes 20040, MX""}, ""5"": {""Direcci칩n"": ""Av. Revoluci칩n Sur No. 550 A, Col. Buenos Aires, Monterrey, Nuevo Le칩n 64800, MX""}}","1994","[""Machinery Manufacturing""]","[""http://www.karcher.com.mx\n      \n\nExternal link for Karcher Mexico SA de CV""]","[""Ciudad Sat칠lite, M칠xico""]","[""Soluciones en Limpieza y Mantenimiento and Equipos de limpieza para el hogar"","" la industria y el comercio""]","{""1"": ""53100"", ""2"": ""11320"", ""3"": ""97210"", ""4"": ""20040"", ""5"": ""64800""}","Aguascalientes,  Aguascalientes,  M칠xico","[{""Nombre"": ""Francisco Mu침oz"", ""Cargo"": ""Coordinador de Sistemas en Karcher Mexico, S.A. de C.V."", ""Foto"": ""https://media.licdn.com/dms/image/v2/C4D03AQGhpLre5HJo-A/profile-displayphoto-shrink_100_100/profile-displayphoto-shrink_100_100/0/1516495169634?e=2147483647&v=beta&t=wCZUO_3WPEyFWlYxOWeb79sWNW3yWrFeEAQiVnv3mps"", ""Perfil"": ""https://mx.linkedin.com/in/francisco-mu%C3%B1oz-5b617213?trk=org-employees""}, {""Nombre"": ""Francisco A. Marquez Montejano"", ""Cargo"": ""Managing Director | K칛rcher M칠xico"", ""Foto"": ""https://media.licdn.com/dms/image/v2/D4E03AQEsFP01sDqEDQ/profile-displayphoto-shrink_100_100/profile-displayphoto-shrink_100_100/0/1694562476500?e=2147483647&v=beta&t=b1o0lCWSDs1ZgD_yyHcjpYsa-xOZzVSeEjem4GB0p3g"", ""Perfil"": ""https://mx.linkedin.com/in/francisco-a-marquez-montejano?trk=org-employees""}, {""Nombre"": ""Karen Medina"", ""Cargo"": ""Direcci칩n Comercial de Retail  LATAM"", ""Foto"": ""https://media.licdn.com/dms/image/v2/D5603AQE3smbhDEGsSQ/profile-displayphoto-shrink_100_100/profile-displayphoto-shrink_100_100/0/1726186246791?e=2147483647&v=beta&t=_qoD1CMVUbUsAaKi1wc6INxxP5dhnsyFb6FXzCdPWHI"", ""Perfil"": ""https://mx.linkedin.com/in/karen-medina-45541126?trk=org-employees""}, {""Nombre"": ""Jos칠 Luis P칠rez Hern치ndez"", ""Cargo"": ""CFO North America Region & Head of Americas Global Business Service en K칛rcher"", ""Foto"": ""https://media.licdn.com/dms/image/v2/D5603AQGpZzbEgvuxjA/profile-displayphoto-shrink_100_100/profile-displayphoto-shrink_100_100/0/1701885462150?e=2147483647&v=beta&t=XAU7nZ97CCCDkMM0VuNPSOwDMFy_DipAQVkeuaEz2mM"", ""Perfil"": ""https://mx.linkedin.com/in/jos%C3%A9-luis-p%C3%A9rez-hern%C3%A1ndez-0910b027?trk=org-employees""}]","https://www.linkedin.com/company/karcher-mexico-sa-de-cv/"
33203,"Sea Cargo Logistics","Somos agente de carga, l칤der en Latinoam칠rica, contamos con 30 a침os de experiencia como integradores de servicios de flete internacional, mar칤timo, a칠reo, terrestre y multimodal (combinaci칩n de cualquiera de los anteriores).
 
Tenemos 16 oficinas en M칠xico, Colombia, Per칰, Costa Rica y Panam치. Ofrecemos las opciones m치s atractivas para importaci칩n y exportaci칩n de mercanc칤as.

Nuestros principales objetivos son:

- Asesorarte en todo tu proceso log칤stico para que tu carga llegue segura de origen a destino final. (Puerta a puerta)
- Comunicaci칩n continua siempre por parte de un humano.
- Contamos con un equipo especializado, asignado para cada proyecto, el cual conocer치s desde el primer contacto.
- Nos especializamos en minimizar los tiempos de tr치nsito y optimizar el presupuesto de tus embarques a trav칠s del an치lisis de la mejor propuesta para tus necesidades de carga.
- Nuestras principales rutas comerciales son: Colombia, Costa Rica, Per칰, Panam치, Italia, Espa침a, Alemania y China.
- Las industrias en las que somos expertos son: Automotriz, Construcci칩n, Perecederos, Industrial, Energ칠tica, Retail y Carga Proyecto (pesada y sobredimiensionada.",,"51-200 employees","{""1"": {""Direcci칩n"": ""Calle Leibnitz 117, Oficina 401, Miguel Hidalgo, Mexico City 11590, MX""}, ""2"": {""Direcci칩n"": ""Avenida Carbonel 4909 3er piso, Col. Panamericana, Chihuahua, Chihuahua 31203, MX""}, ""3"": {""Direcci칩n"": ""Av. del Altillo 220-9 Bodega 23, Col. Villa de San Miguel, Guadalupe, Nuevo Leon 67110, MX""}, ""4"": {""Direcci칩n"": ""Av. Ni침os Heroes 2905-1, Col. Jardines del Bosque, Guadalajara, Jalisco 44520, MX""}, ""5"": {""Direcci칩n"": ""Boulevard Hacienda del Jacal 422, Col. Jardines de la Hacienda, Jardines de la Hacienda, Quer칠taro Arteaga 76180, MX""}, ""6"": {""Direcci칩n"": ""Torre Natyvo, Blvd. de Los Reyes N춿6431, Piso 9, 907, San Bernardino, Tlaxcalancingo, San Andr칠s Cholula, Puebla 72820, MX""}, ""7"": {""Direcci칩n"": ""Av. Capit치n Carlos Le칩n S/N, Pe침칩n de los Ba침os, Venustiano Carranza, CDMX 15620, MX""}, ""8"": {""Direcci칩n"": ""Edif. Grupo Financiero Inbursa, Av. Las Am칠ricas N춿110, Oficina 101, Col. La Fuente, Aguascalientes 20239, MX""}, ""9"": {""Direcci칩n"": ""Blvd.Teniente J.Azueta 130-214, Recinto Portuario, Ensenada, Baja California 22830, MX""}, ""10"": {""Direcci칩n"": ""Calle 22, N춿40, Local 23 y 24, Col. San Antonio Cinta, M칠rida, Yucat치n 97139, MX""}, ""11"": {""Direcci칩n"": ""Blvd. San Pedro, 245, Paseo de los Colibries, Colonia San Isidro, Le칩n Guanajuato 37510, MX""}, ""12"": {""Direcci칩n"": ""Av. Sierra Leona 360 Piso 9, Oficina 948, Villantigua, San Luis Potos칤 78214, MX""}, ""13"": {""Direcci칩n"": ""Jr. Dominguez No.105, Oficina 501, San Borja, Lima, PE""}, ""14"": {""Direcci칩n"": ""Calle 12 No. 43D - 67, Int. 201, Barrio Manila, Medellin Antoquia, CO""}, ""15"": {""Direcci칩n"": ""R칤o Segundo de Alajuela 200 mts. al Norte del Hotel Holliday Inn, Oficentro Santa Mar칤a Oficina 4 A, Costa Rica, San Jos칠, CR""}, ""16"": {""Direcci칩n"": ""Edificio Obarrio 60, Oficina 8F, Calle 60, Este  Obarrio, Panam치 0832-0588, PA""}}","2009","[""Transportation"","" Logistics"","" Supply Chain and Storage""]","[""https://seacargo.com?utm_source=linkedin&utm_medium=social&utm_campaign=pagprincipallinkedin&utm_id=pagprincipal&utm_content=infolinkedin\n      \n\nExternal link for Sea Cargo Logistics""]","[""Miguel Hidalgo, Mexico City""]","[""International Transport"","" Logistics"","" Distribution"","" Industrial Cargo Projects"","" Transporte de Mercanc칤as"","" Agente de carga"","" Transporte A칠reo"","" Transporte Terrestre"","" Carga Proyecto"","" Importaci칩n"","" Exportaci칩n"","" Carga Internacional"","" Agente Log칤stico"","" Cadena de suministro"","" Log칤stica y distribuci칩n"","" Despacho Aduanal"","" Seguro de Carga"","" Agente Aduanal"","" Transitario"","" Empresa de log칤stica y transporte"","" Transporte Mar칤timo"","" and Comercio internacional""]","{""1"": ""11590"", ""2"": ""31203"", ""3"": ""67110"", ""4"": ""44520"", ""5"": ""76180"", ""6"": ""72820"", ""7"": ""15620"", ""8"": ""20239"", ""9"": ""22830"", ""10"": ""97139"", ""11"": ""37510"", ""12"": ""78214""}","Aguascalientes,  Aguascalientes,  M칠xico","[{""Nombre"": ""Raquel Haj Wong"", ""Cargo"": ""Ocean Freight Director"", ""Foto"": ""https://media.licdn.com/dms/image/v2/D5603AQErbKnpKRaD-A/profile-displayphoto-shrink_100_100/profile-displayphoto-shrink_100_100/0/1732490440005?e=2147483647&v=beta&t=axlnPcPtEw-TMM6GFmqW15LONM-_dL6hSTHNGqzceJM"", ""Perfil"": ""https://mx.linkedin.com/in/raquel-haj-wong?trk=org-employees""}, {""Nombre"": ""Gisela L칩pez"", ""Cargo"": ""Human Resources en Sea Cargo Logistics"", ""Foto"": ""https://media.licdn.com/dms/image/v2/C5603AQElLnPjT-BQeQ/profile-displayphoto-shrink_100_100/profile-displayphoto-shrink_100_100/0/1517766345112?e=2147483647&v=beta&t=W4Y6l6lmB_5DGlEBflIpLcnMEVz7JHGX3DmTazdotrw"", ""Perfil"": ""https://mx.linkedin.com/in/giselalopez?trk=org-employees""}, {""Nombre"": ""Marco Bellisario"", ""Cargo"": ""Manager at Sea Cargo Logistics"", ""Foto"": ""https://media.licdn.com/dms/image/v2/C4D03AQFoQGLQtYZ75g/profile-displayphoto-shrink_100_100/profile-displayphoto-shrink_100_100/0/1516587263890?e=2147483647&v=beta&t=v832XWFgJvHZTfWIHfCfO4bJm6lSf7TTSztCp8csra4"", ""Perfil"": ""https://cr.linkedin.com/in/marcobellisario1980?trk=org-employees""}, {""Nombre"": ""Rafael M."", ""Cargo"": ""Corportate Business Manager Sea Cargo Logistics."", ""Foto"": ""https://media.licdn.com/dms/image/v2/C4D03AQGQY7Nf5Fhosw/profile-displayphoto-shrink_100_100/profile-displayphoto-shrink_100_100/0/1516882563830?e=2147483647&v=beta&t=qNouZuUPU-0NvfKE3e7afirg0-XK92Sjmd8DI1o3cn0"", ""Perfil"": ""https://pe.linkedin.com/in/rafael-m-671aa11b?trk=org-employees""}]","https://www.linkedin.com/company/seacargologistics/"
33204,"KoiReader Technologies","KoiReader Technologies is a pioneer and global leader in Vision and Generative Al-powered Logistics, Supply Chain, and Industrial Automation solutions, and recognized in the industry for its KoiVision춽 Digital Operations Platform and Al Operating Model.

As AI projects continue to fail to deliver value globally for lack of accuracy, lack of value, and complexity of integration, industry leaders such as NVIDIA and PepsiCo have endorsed KoiVision춽 Platform for its offerings that include Warehouse, Yard, and Manufacturing Intelligence.",,"51-200 employees","{}","2019","[""Transportation"","" Logistics"","" Supply Chain and Storage""]","[""https://www.koireader.com\n      \n\nExternal link for KoiReader Technologies""]","[""Dallas, Texas""]","[""Logistics"","" Artificial Intelligence"","" Computer Vision"","" Transportation"","" FreightTech"","" Image Processing"","" Multimodal Transportation"","" Warehouse Automation"","" Yard Automation"","" Port Automation"","" Factory Automation"","" Enterprise AI"","" Industrial Automation"","" and Manufacturing Automation""]","{}","Aguascalientes,  Aguascalientes,  M칠xico","null","https://www.linkedin.com/company/koireader/"
