id ×,Nombre ×,Resumen ×,Telefono ×,Tamano ×,Ubicacion ×,Sector ×,Sede ×,Codigo_postal ×,Ciudad ×
786,Juguetibici,"Somos una empresa juguetera 100% mexicana, con más de 30 años de experiencia en hacer sonreír a chicos y grandes. Nuestro concepto de tiendas esta ori...",5550787070,501-1000 empleados,"Principal
JUGUETIBICI VALLEJO
Calz. Vallejo 925. Col. Lindavista Vallejo, CDMX, CDMX 07720, MX, JUGUETIBICI ESPACIO AGUASCALIENTES
Centro Comercial Espacio Aguascalientes - Av. Tecnológico 120 local LB-7 LB-8 y LB-9. Esq. Av. Adolfo López Mateos, Col. Ex Ejido Ojocaliente, AGUASCALIENTES, AGUASCALIENTES 20196, MX, JUGUETIBICI OASIS COYOACÁN
Centro Comercial Oasis Coyoacán - Av. Universidad 1778, PA-27, Col. Romero de Terreros, 04310, CDMX 04310, MX, JUGUETIBICI FORUM BUENAVISTA
Centro Comercial Forum Buenavista - Eje 1 Norte (Mosqueta) # 259, Local 1-19 Col. Buenavista, CDMX, CDMX 06350, MX, JUGUETIBICI MIRAMONTES
Canal de Miramontes # 3000 Mz. 5 C 34 C, Col. Alianza Popular Revolucionaria, CDMX, CDMX 04800, MX, JUGUETIBICI PARQUE DELTA
Centro Comercial Parque Delta - Av. Cuauhtémoc # 462 local 274, Col. Narvarte, CDMX, CDMX 03020, MX, JUGUETIBICI PARQUE LAS ANTENAS
Centro Comercial Parque las Antenas - Av. Anillo Periferico #3278. L 280, 280B, 280C, 281, 281B, 281C, Col. La Esperanza, CDMX, CDMX 09910, MX, JUGUETIBICI PARQUE LINDAVISTA
Centro Comercial Parque Lindavista - Colector 13 # 280 locales 208-209, Col. Lindavista, CDMX, CDMX 07300, MX, JUGUETIBICI PARQUE TEZONTLE
Centro Comercial Parque Tezontle - Av. Canal de Tezontle # 1512 local 251 y 252, Col. Alfonso Ortiz Tirado, CDMX, CDMX 09020, MX, JUGUETIBICI PASEO ACOXPA
Centro Comercial Paseo Acoxpa - Calz. Acoxpa # 430 Loc. 35 y 36, Col. Ex Hacienda Coapa, CDMX, CDMX 14300, MX, JUGUETIBICI PATIO SANTA FE
Centro Comercial Patio Santa Fe - Av. Prolongación Paseo de la Reforma No. 400 Loc. SC-06, Col. Peña Blanca Santa Fe, CDMX, CDMX 01210, MX, JUGUETIBICI PATIO TLALPAN
Centro Comercial Patio Tlalpan - Av. Insurgentes Sur 4177 Local SA-06, Col. Santa Ursula Xitla, CDMX, CDMX 14420, MX, JUGUETIBICI PORTAL CENTRO
Centro Comercial Portal Centro - Lorenzo Boturini 258 Local SC08, Col. Transito, CDMX, CDMX 06820, MX, JUGUETIBICI PORTAL LOMAS ESTRELLA
Centro Comercial Portal Lomas Estrella - Av. Tláhuac #4409 local SC-13, Col. Lomas Estrella, CDMX, CDMX 09890, MX, JUGUETIBICI PORTAL SAN ANGEL
Centro Comercial Portal San Angel - Av. Revolución 1267 Local SC-15, Col. Alpes, CDMX, CDMX 01040, MX, JUGUETIBICI ROJO GÓMEZ
Av. Rojo Gómez 210 esq. Sur 12 local 1, 2, 3, Col. Agrícola Oriental, CDMX, CDMX 08500, MX, JUGUETIBICI AMBAR FASHION MALL TUXTLA
Centro Comercial Amber Fashion Mall Tuxtla - Carretera Tuxtla - Chiapa de Corzo No. 651, Local 1N-40, TUXTLA GUTIÉRREZ, CHIAPAS 29040, MX, JUGUETIBICI COSMOPOL COACALCO
Centro Comercial Cosmopol Coacalco - Vía Lopez Portillo #1 Local E206, Col. San Francisco Coacalco, EDO MEX, EDO MEX 55700, MX, JUGUETIBICI CUAUTITLÁN IZCALLI
Av. 1ro de Mayo Lt. 89 Mz. 34B, Col. Corredor Urbano. Cuautitlán Izcalli, EDO MEX, EDO MEX 54700, MX, JUGUETIBICI INTERLOMAS
Paseo de la Herradura l-8 m-2., Col. San Fernando la Herradura. Huixquilucan, EDO MEX, EDO MEX 52760, MX, JUGUETIBICI LAS FLORES COACALCO
Centro Comercial Las Flores Coacalco - Av. Vía José López Portillo # 105 loc. 17, Col. Zacuatitlán. Coacalco, EDO MEX, EDO MEX 55700, MX, JUGUETIBICI LUNA PARC
Centro Comercial Luna Parc - Av. 1ro de mayo S/N Loc. 303, 304 y 305 Mz. 5 C-34-C, Col. Centro Urbano. Cuautitlán Izcalli, EDO MEX, EDO MEX 54800, MX, JUGUETIBICI PABELLÓN METEPEC
Centro Comercial Pabellón Metepec - Vialidad Metepec # 505 Loc. 9, 10, 19 y 31, Col. Ex Rancho San Javier. Metepec, EDO MEX, EDO MEX 52140, MX, JUGUETIBICI PARQUE TOREO
Centro Comercial Parque Toreo - Blvd. Manuel Ávila Camacho No. 5, Local 214, Col. Lomas de Sotelo. Naucalpan de Juárez, EDO MEX, EDO MEX 53390, MX, JUGUETIBICI PASEO INTERLOMAS
Centro Comercial Paseo Interlomas - Vialidad de la Barranca #6 Loc. N2-02, Col. Ex Hacienda Jesús del Monte. Fracc. Interlomas. Huixquilucan, EDO MEX, EDO MEX 52763, MX, JUGUETIBICI PATIO TOLUCA
Centro Comercial Patio Toluca. Av. Miguel Hidalgo #1350 L-39, Toluca de Lerdo, EDO MEX, EDO MEX 50010, MX, JUGUETIBICI PUERTA TEXCOCO
Centro Comercial Puerta Texcoco - Carr. Fed. México-Texcoco Km 30.5 Local 114 al 116, Santiago Cuautlalpan, EDO MEX, EDO MEX 56255, MX, JUGUETIBICI TOWN CENTER NICOLÁS ROMERO
Centro Comercial Town Center Nicolás Romero - Arturo Montiel Rojas Km 10.7 Local C-08 y C-09, Col. Vista hermosa 2da. Municipio Nicolás Romero, EDO MEX, EDO MEX 54400, MX, JUGUETIBICI TOWN CENTER ZUMPANGO
Centro Comercial Town Center Zumpango - Carretera Zumpango-Los Reyes Acozac No 2000. Local J-07, J-08, Col. Zumpango de Ocampo, EDO MEX, EDO MEX 55600, MX, JUGUETIBICI ALAÏA GUANAJUATO
Centro Comercial Alaïa Guanajuato: Blvd. Euquerio Guerrero 139 Local L-49, L-50, GUANAJUATO, GUANAJUATO 36250, MX, JUGUETIBICI LA ISLA SHOPPING VILLAGE ACAPULCO
Centro Comercial La Isla Shopping Village Acapulco - Blvd. De las Naciones Nº 1813 Loc. L-70 Lt. 1 Mz. 5, Col. Playa Diamante Acapulco de Juárez, ACAPULCO, GUERRERO 39760, MX, JUGUETIBICI FORUM TLAQUEPAQUE
Centro Comercial Forum Tlaquepaque - Blvd. Marcelino García Barragán # 2017 Loc. PA 31-A, Col. Prados de Nilo. Guadalajara, GUADALAJARA, JALISCO 44840, MX, JUGUETIBICI GRAN TERRAZA OBLATOS
Centro Comercial Gran Terraza Oblatos - Av. Circunvalación 2700, Local L-131, L-132, Col. Oblatos. Guadalajara, GUADALAJARA, JALISCO 44700, MX, JUGUETIBICI LAS PLAZAS OUTLET GUADALAJARA
Centro Comercial Las Plazas Outlet Guadalajara - Carr. Guadalajara-Morelia Km. 12.5 Loc. 77-78, Tlajomulco de Zúñiga, GUADALAJARA, JALISCO 45640, MX, JUGUETIBICI MIDTOWN JALISCO
Centro Comercial Midtown Jalisco - Av. Adolfo Lopez Mateos Norte 2405 Local L-99, Col. Italia Providencia, GUADALAJARA, JALISCO 44648, MX, JUGUETIBICI URBAN CENTER LA RIOJA
Centro Comercial Urban Center La Rioja - Av. Lopez Mateos #7000 L14/L15, Fracc. La Rioja. Municipio Tlajomulco de Zúñiga, GUADALAJARA, JALISCO 45645, MX, JUGUETIBICI PLAZA PATRIA
Centro Comercial Plaza Patria: Av.Patria S/N. LOCAL E-9., Col. Jacarandas. Entre Av. Manuel Avila Camacho y Av. de las Americas, GUADALAJARA, JALISCO 45160, MX, JUGUETIBICI LA ISLA PUERTO VALLARTA
Centro Comercial La Isla Vallarta - Blvd. Francisco Medina Ascencio 2479. Local PB-22, Zona Hotelera Norte. Pto. Vallarta, PUERTO VALLARTA, JALISCO 48333, MX, JUGUETIBICI FORUM CUERNAVACA
Centro Comercial Forum Cuernavaca - Calle Jacarandas, No. 103, Local PB-21, Ricardo Flores Magón, CUERNAVACA, MORELOS 62370, MX, JUGUETIBICI PORTAL D10
Centro Comercial Portal D10 - Av. Domingo Diez no. 1203 Local SB07, Col. Lomas de la Selva Norte, CUERNAVACA, MORELOS 62145, MX, JUGUETIBICI EXPLANADA PUEBLA
Centro Comercial Explanada Puebla - Calle Alejandra S/N Local RF-22, Santiago Momoxpan. San Pedro Cholula, CHOLULA, PUEBLA 72775, MX, JUGUETIBICI PARQUE PUEBLA
Centro Comercial Parque Puebla - Calzada Ignacio Zaragoza 410 Locales 226 y 227, Corredor Industrial la Cienega, PUEBLA, PUEBLA 72220, MX, JUGUETIBICI EL PASEO TEHUACÁN
Centro Comercial Paseo Tehuacán - Calz. Adolfo López Mateos # 3800 Loc. 79, Col. San Lorenzo Teotipilco, TEHUACÁN, PUEBLA 75855, MX, JUGUETIBICI URBAN CENTER JURIQUILLA
Centro Comercial Urban Center Juriquilla - Blvd. Juriquilla y Blvd. de la Campana # 889 Lt.1 Mz. 1 Loc. 6-A 7 y 8, Col. Residencial Caletto, QUERÉTARO, QUERÉTARO 76230, MX, JUGUETIBICI PASEO QUERÉTARO
Centro Comercial Paseo Querétaro - Carr. Fray Junipero Serra 7901 Local PA-19, Col. La Purísima, QUERÉTARO, QUERÉTARO 76146, MX, JUGUETIBICI GALERÍAS MÉRIDA
Centro Comercial Galería Mérida - Calle 60 #299. Local 245, Col. Revolución, MÉRIDA, YUCATÁN 97115, MX, JUGUETIBICI LA ISLA SHOPPING VILLAGE MÉRIDA
Centro Comercial La Isla Shoppig Village - Calle 24 #30020, LOCAL PA-14, MÉRIDA, YUCATÁN 97305, MX, JUGUETIBICI UPTOWN MÉRIDA
Centro Comercial UpTown Mérida - Av. Correa Rancho 104 Local L-32, Col. Vista Alegre Norte, MÉRIDA, YUCATÁN 97138, MX, JUGUETIBICI URBAN CENTER MÉRIDA
Centro Comercial Urban Center Mérida - Ave. Camara de Comercio 174. L-32, Col. Monterreal, MÉRIDA, YUCATÁN 97138, MX",Comercio al por menor,"CDMX, CDMX",07720,Tuxtla Gutierrez
798,INDASA,"Somos una empresa mexicana de productos derivados del acero y comprometida con el medio ambiente, nuestros colaboradores y el mercado. Buscando la inn...",222 281 2000,201-500 empleados,,Comercio al por mayor de materiales de construcción,"Puebla, Puebla",,Tuxtla Gutierrez
788,Agroveterinaria La Potranca,"Somos una empresa 100% mexicana dedicada a mejorar la productividad y eficiencia del sector agropecuario, así como a satisfacer las necesidades de nue...",,51-200 empleados,"Principal
Avenida Juan de la Luz Enriquez 312, Lerdo de Tejada, Veracruz 95280, MX, 5ta Sur #2430-B casi esquina con 23 Poniente., Tuxtla Gutiérrez, Chiapas 29060, MX, Independencia 21-A Col. Centro, Tuxtepec, Oaxaca 68300, MX, Lerdo de Tejada #205, Col. Centro, Macuspana, Tabasco 86700, MX, Boulevard Adolfo Ruíz Cortines #1810, Colonia Carrizal, Villahermosa, Tabasco 86100, MX, Calle Tampico #402 entre Nayarit y Puebla, Col. Guadalupe, Tampico, Tamaulipas MX, Porfirio Diaz #302 Col. El Zapotal, Acayucan, Veracruz 96000, MX, Miguel Hidalgo #104, Col. Zapotal, Acayucan, Veracruz 96039, MX, Avenida Urano #15 Col. Joyas de Mocambo, Boca del Río, Veracruz 94294, MX, Av. Raúl Sandoval #378 A, Col. Centro, Cd. Isla, Veracruz 95641, MX, Av. 11 #1025, Col. San José, Córdoba, Veracruz 94500, MX, Independencia #700, local 1 entre Juárez y callejón de la Parroquia. Col. Centro, Playa Vicente, Veracruz 95600, MX, Calle 4 #413, Col. Cazones. Entre Av. Uno y Municipio Libre, Poza Rica, Veracruz 93230, MX, C. Boulevard 5 de Febrero S/N, Col. 1° de Mayo, San Andrés, Veracruz 95700, MX, La Victoria. José Luis Cabildo S/N, San Andrés Tuxtla, Veracruz 95801, MX, Carretera Federal México-Nautla S/N, Col. Centro. Entre calles Juan de Dios Peza y 16 de Septiembre, San Rafael, Veracruz 93620, MX, 16 de Septiembre #908, entre Juárez y Serdán. Col. Centro, Tierra Blanca, Veracruz 95100, MX, Revolución No. 433, Col. del Maestro, Xalapa, Veracruz 91030, MX, Calle Francisco J. Moreno #59, Col. Centro. Entre calle Libertad y Úrsulo Galván, Ángel R. Cabada, Veracruz MX, Calle 42 #196 entre calles 23 y 27. Fracc. Linda Vista, Chenku, Mérida, Yucatán 97219, MX",Ganadería,"Lerdo de Tejada, Veracruz",95280,Tuxtla Gutierrez
789,Instituto Tecnológico Nacional de México campus Tuxtla Gutiérrez,"Institución de Excelencia en la Educación Superior Tecnológica del Sureste, comprometida con el desarrollo socioeconómico sustentable de la región....",(961)6150461,51-200 empleados,"Principal
Carretera Panamericana Km. 1080, Tuxtla Gutiérrez, Chiapas 29050, MX",Enseñanza superior,"Tuxtla Gutiérrez, Chiapas",29050,Tuxtla Gutierrez
790,Alternativa 19 del Sur,"Somos una financiera dedicada al otorgamiento de créditos y microcréditos, con recursos económicos sólidos y de fácil acceso, apoyamos por igual a per...",,501-1000 empleados,"Principal
11 Norte Poniente #1147 Altos Fraccionamiento Vista Hermosa
Tuxtla Gutiérrez, Chiapas 29030, MX",Servicios financieros,"Tuxtla Gutiérrez, Chiapas",29030,Tuxtla Gutierrez
791,Unitam Uniformes,"UNITAM Uniformes es una empresa con más de 69 años, especializada en la elaboración y comercialización de #uniformes industriales, ejecutivos, casuale...",8331484613,501-1000 empleados,"Unitam Aguascalientes
Avenida de la Convención 1914 Pte. 1115 Col. Fraccionamiento de las Torres , Aguascalientes, Aguascalientes 20293, MX, Unitam Tijuana Zona Río
Av. Diego Rivera 2589 esq. Blvd. Sánchez Taboada col. Zona urbana río Tijuana, edificio Ethel local 1B , Tijuana , Baja California 22010, MX, Unitam Mexicali Justo Sierra
Calzada Justo Sierra esq. Av. Herreros sur 2098 col. Burocratas, local 1 y 2 , Mexicali, Baja California 21020, MX, Unitam Mexicali Lázaro Cárdenas
Lázaro Cárdenas 2998-1 fraccionamiento Nuevo Mexicali, Plaza Rasa , Mexicali, Baja California 21399, MX, Unitam Tijuana Díaz Ordaz
Blvd. Díaz Ordaz 1100A col. La mesa , Tijuana , Baja California 22105, MX, Unitam Los Cabos
5 de Febrero mz 220 S/N col. Ejidal Chamizal , local 1, Los Cabos San Lucas , Baja California Sur 23470, MX, Unitam Cd. Del Carmen
Calle 47 #63 col. Santa Margarita , Cd. Del Carmen , Campeche 24120, MX, Unitam Coyoacan
Av. Universidad 1909 col. Oxtopulco universidad , Coyoacan , CDMX 04318, MX, Unitam Tuxtla
Blvd. Belisario Domínguez 1728 col. Arboledad , Tuxtla Gutiérrez , Chiapas 29030, MX, Unitam Cd. Juárez Gómez Morin
Blvd. Gómez Morín 7950 A-8 col. Ampliacion Campestre , Cd. Juárez , Chihuahua 32469, MX, Unitam Cd. Juárez Paseo Victoria
Av. Teófilo Borunda 8670-A esq. con paseo de la Victoria col. partido iglesias , plaza comercial Paseo Victoria local 14 y 15, Cd. Juárez , Chihuahua 32528, MX, Unitam Chihuahua Ortiz Mena
Blvd. Antonio Ortiz Mena 120 col. San Felipe , Chihuahua, Chihuahua 31203, MX, Unitam Chihuahua Saucito
Periférico de la juventud y Av. Francisco Villa S/N col. Saucito , Plaza Saucito local 22, Chihuahua, Chihuahua 31110, MX, Unitam Saltillo
Blvd. Venustiano Carranza 1921 col. República Pte., Saltillo, Coahuila 25265, MX, Unitam Torreón Independencia
Blvd. Independencia 37 col. Los ángeles , Torreón , Coahuila 27140, MX, Unitam Torreón Juárez Oriente
Av. Juárez 3510 ote. col. Centro , Torreón , Cohuila 27000, MX, Unitam Durango
Francisco villa 200 fraccionamiento la glorieta , Plaza Jardines local 4 , Durango , Durango 34207, MX, Unitam Ecatepec
Vía Morelos 102 Mz 1 col. Nuevo Laredo, lote 4 y 5, Ecatepec de Morelos , Edo. de México 55080, MX, Unitam Iztacalco
Av. Javier Rojo Gómez 210 esq. sur 12 col. Agricola Oriental , local 2, Iztacalco , Edo. de México 08500, MX, Unitam Naucalpan
Vía Gustavo Baz 128 fracc. Bosques de Echegaray , Plaza Mach local 2A , Naucalpan, Edo. De México 53310, MX, Unitam Toluca
Av. José María Pino Suárez 1419E col. Valle Verde , Toluca , Edo. De México 50160, MX, Unitam León Francisco Villa
Blvd. Francisco Villa 901 col. Villa de las flores , Plaza comercial las flores local 15, León , Guanajuato 37278, MX, Unitam León Hidalgo
Blvd. Hidalgo 1820 col. San Jerónimo , León , Guanajuato 37204, MX, Unitam Acapulco
Avenida Costera Miguel Alemán 1702, local 2, Acapulco , Guerrero 39670, MX, Unitam Puerto Vallarta
Av. Francisco Villa 1010 col. Jardines de Vallarta , Plaza Parota local 22, Puerto Vallarta , Jalisco 48328, MX, Unitam Guadalajara Americas
Av. Americas 28 col. Lafayette, Guadalajara , Jalisco 44150, MX, Unitam Guadalajara Niños Héroes
Av. Niños Héroes 2716-4 esq. Av Arcos col. Jardines del bosque , Guadalajara , Jalisco 44520, MX, Unitam Morelia
Av. Lázaro Cárdenas 2321 col. Chapultepec Norte , Morelia , Michoacán 58260, MX, Unitam Cuernavaca
Av. Plan de Ayala 518 col. Amatitlán , local 7 , Cuernavaca , Morelos 62410, MX, Unitam Guadalupe
Carretera Miguel Alemán 4425 col. Linda vista , Guadalupe, Nuevo León 67130, MX, Unitam Mitras
Av. Madero 3540 Pte. col. Mitras sur, Monterrey , Nuevo León 64020, MX, Unitam San Nicolás
Av. Nogalar sur 195 col. Cuauhtémoc, , San Nicolás de los garza, Nuevo León 66450, MX, Unitam San Pedro
José Vasconcelos 2 col. Sierra Madre , entre Jerónimo Siller y privada Sierra Madre , San Pedro Garza García , Nuevo León 66250, MX, Unitam Oaxaca
Calzada Porfirio Díaz 236 B col. Reforma , Oaxaca de Juárez, Oaxaca 68050, MX, Unitam Puebla Juan Pablo
Circuito Juan Pablo II 1715 Rivera del Atoyac , Puebla, Puebla 72430, MX, Unitam Puebla 25 Sur
Calle 25 sur esq. 25 pte. 2502 col. Volcanes , local 1A , Puebla , Puebla 72410, MX, Unitam Querétaro Constituyentes
Av. Constituyentes 126 pte. esq. Ignacio Pérez Zona centro , local 3 , Querétaro , Querétaro 76000, MX, Unitam Querétaro Plaza Zoco
Autopista México-Querétaro fracc. Las misiones , Plaza Zoco local 6 y 7 , Querétaro , Querétaro 76030, MX, Unitam Cancún
Av. José López Portillo sm 59 Mz 38 , local 4 , Cancún, Quintna Roo 77520, MX, Unitam San Luis Potosí Carranza
Av. Venustiano Carranza 1905 col. Jardín , San Luis Potosí , San Luis Potosí 78270, MX, Unitam San Luis Potosí El Paseo
Costado sur central camionera 376 col. El paseo , San Luis Potosí , San Luis Potosí 78320, MX, Unitam Culiacán
Av. Álvaro Obregón 425 sur col. Jorge col. Jorge Almada , Culiacán , Sinaloa 80200, MX, Unitam Los Mochis
Blvd. Adolfo López Mateos 1042 Fracc. Juan Cota , Plaza El Quijote local 2 , Los Mochis , Sinaloa 81220, MX, Unitam Sinaloa
Carretera Internacional col. El venadillo , local 4, Mazatlán , Sinaloa 82129, MX, Unitam Hermosillo San Benito
Nayarit 9 esq. Mariano Matamoros P/B col. San Benito , Hermosillo, Sonora 83190, MX, Unitam Hermosillo Solidaridad
Blvd. Solidaridad 164 int. D Plaza de las francias , Hermosillo , Sonora 83200, MX, Unitam Villahermosa Atasta
Blvd. Adolfo Ruiz Cortinez 1420 col. Atasta, Plaza city center local H17 y H24 , Villahermosa , Tabasco 86100, MX, Unitam Villahermosa Universidad
Av. Universidad 322 B col. El Recreo , Villahermosa , Tabasco 86020, MX, Unitam Tampico Norte
Carretera Tampico Mante , 2602, Tampico, Tamaulipas 89359, MX, Unitam Tampico Centro
colón 114 Nte zona centro , Tampico , Tamaulipas 89000, MX, Unitam Reynosa
Blvd. Morelos 2424 col. Prolongación Longoria , Edificio San Miguel Bosque local 3, Reynosa , Tamaulipas 88660, MX, Unitam Tampico Ejercito
Ejército Méxicano 310 col. Guadalupe, Tampico , Tamaulipas 89120, MX, Unitam Coatzacoalcos
Av. Zaragoza 517-A col. Centro , Coatzacoalcos , Veracruz 96400, MX, Unitam Boca del Río
Blvd. Adolfo Ruiz Cortinez 1517 costa de oro , Boca del Río , Veracruz 94299, MX, Unitam Poza Rica
Av. Juárez 102-A col. 27 de septiembre , Poza Rica , Veracruz 93320, MX, Unitam Veracruz
Av. Miguel Alemán Valdés 43 zona centro , entre Sánchez Tagle y Campero , Veracruz , Veracruz 91700, MX, Unitam Mérida
Circuito colonia entre calle 9 y calle 7 col. García Gineres , Plaza pensiones 217-B, Mérida , Yucatán 97070, MX, Unitam Zacatecas
Héroes de chapultepec 401 col. Minera , Plaza Alessia local 12B, Zacatecas , Zacatecas 98050, MX",Comercio al por mayor de prendas de vestir y suministros para confección,"Tampico, Tamaulipas",20293,Tuxtla Gutierrez
792,Grupo Pereyra,"Empresa 100% mexicana con más de 25 años de experiencia en el servicio de abastecimiento a empresas privadas y gubernamentales.

Fundada en el año 199...",993 353 5727,51-200 empleados,,Fabricación de alimentos y bebidas,"Villahermosa, Tabasco",,Tuxtla Gutierrez
793,Soluciones en Tecnologías,"Soluciones en Tecnologías es una empresa 100% mexicana, comprometida en ofrecer a todos sus clientes y socios de negocios, los mejores servicios y apl...",9611210756,11-50 empleados,"Principal
Soluciones en Tecnologías
Av. Herradura #240, Fracc. Loma Real, Tuxtla Gutiérrez, Chiapas 29010, MX",Servicios y consultoría de TI,"Tuxtla Gutiérrez, Chiapas",29010,Tuxtla Gutierrez
794,Expertos en Preparación y Aplicación de Superficies Aprosi México,"Empresa Líder en Sistemas de Conservación de Superficies. 

Con 35 años Aprosi Equipos es una empresa experta en soluciones de limpieza de superficies...",800 277 6741,11-50 empleados,"Principal
Av. Dr. Gustavo Baz 83, Tlalnepantla, Estado de México 54080, MX, Cd. Del Carmen
Av. Isla de Tris No. 194 Col. Belisario Dominguez, Ciudad Del Carmen, Campeche 24150, MX, Tuxtla Gutiérrez, Chiapas
9a. Sur Poniente No. 842 Local A y B Col. Centro, Tuxtla Gutiérrez, Chiapas 2900, MX, Celaya, Guanajuato
Av. Tecnológico 34, Celaya, Guanajuato 38010, MX, Zapopan, Jalisco
Adolfo López Mateos Sur 5777, Zapopan, Jalisco 45080, MX, Guadalupe, Nuevo León
Av. Las Américas Norte No. 403, Colonia Las Américas,, local, Guadalupe, Nuevo León 67130, MX, Hermosillo, Sonora
Periférico Sur. No. 777, Y Griega, Local, Hermosillo, Sonora 83290, MX, Villahermosa, Tabasco
Av. Adolfo Ruiz Cortinez 704, Villahermosa, Tabasco 86040, MX, Veracruz, Veracruz
Calzada Simón Bolívar 981-B, Col. Ignacio Zaragoza, Local, Veracruz, Veracruz 91910, MX",Fabricación de maquinaria,"Tlalnepantla, Estado de México",54080,Tuxtla Gutierrez
795,CONSERVA,"Somos una Microfinanciera con presencia en diversos estados de la república Mexicana,  mejorando la calidad de vida de nuestros clientes....",8002909000,501-1000 empleados,"Principal
Corporativo
TUXTLA GUTIERREZ , CHIAPAS 29040, MX",Servicios financieros,"TUXTLA GUTIERREZ , CHIAPAS",29040,Tuxtla Gutierrez
796,Universidad Pablo Guardado Chávez,"31 años formando profesionales con valores, conocimientos académicos y actitud emprendedora. No arriesgues tu futuro estudia con nosotros Hoy....",(961) 614 11 12,201-500 empleados,"Principal
Campus Chiapas
Libramiento Norte Oriente #3450, Tuxtla Gutiérrez, Chiapas 29040, MX",Enseñanza superior,"Tuxtla Gutiérrez, Chiapas",29040,Tuxtla Gutierrez
799,Holiday Inn Tuxtla,Somos el hotel más grande de Chiapas con 219 habitaciones y la alberca más grande de toda la ciudad. Contamos con 14 salones para eventos con capacida...,,201-500 empleados,"Principal
Holiday Inn Tuxtla
Boulevard Belisario Domínguez Km 1081 C.P. 29000, Tuxtla Gutiérrez, Chiapas 29000, MX",Organización de viajes,"Tuxtla Gutiérrez, Chiapas",29000,Tuxtla Gutierrez
800,Instituto Oftavisión,"El Instituto Oftavisión es una red de clínica oftalmológicas dedicadas al diagnóstico y tratamiento para el cuidado de los ojos, con presencia en trec...",81 2002 5252,201-500 empleados,"José María No. 150 entre calle 6ta y 7ma ex ejido Chapultepec, C.P. 22785, Ensenada, Baja California, México.
Ensenada, Baja California 22785, MX, Boulevard Ángel Albino Corzo No. 1359 Col. El Retiro, C.P. 29040, Tuxtla Gutierrez, Chiapas, México.
Tuxtla Gutiérrez, Chiapas 29040, MX, Calle 62, Colonia Centro, Cp. 97000
Mérida, Mérida 97000, MX, Álvaro Obregón #23 Zona Centro Ciudad Valles, San Luis Potosí, Ciudad Valles, Mexico
Ciudad Valles, San Luis Potosí MX, Guillermo Prieto No. 811 norte Col. Centro, C.P. 81200, Los Mochis, Sinaloa, México.
Los Mochis, Sinaloa 81200, MX, Rafael Buelna No. 202 Int. 15 Hacienda Las Cruces, C.P. 82126, Mazatlán, Sinaloa, México.
Mazatlán, Sinaloa 82126, MX, Periférico Norte No. 175 Esq. Gral. Bernardo Reyes Plaza Reyes Col. Jesús García C.P. 83140 Hermosillo, Sonora.
Hermosillo, Sonora 83140, MX, Carretera federal Cárdenas-Comalcalco km 18 poblado Carlos Rovirosa, C.P. 86680, Cunduacán, Tabasco, México.
Cunduacán, Tabasco 86680, MX, Boulevard López Mateo #121, Colonia Unidad Nacional, Cp. 89410
Ciudad Madero, Tamaulipas 89410, MX, Calle Pedro María Anaya #398, Colonia San Francisco, Cp. 87050
Ciudad Victoria, Tamaulipas 87050, MX, Zaragoza 3 Col. Centro Esq. Zósimo Pérez Castañeda. C.P. 92800, Túxpan de Rodríguez Cano, Veracruz, México.
Tuxpan, Veracruz 92800, MX",Salud y servicios sociales,"Ciudad Victoria, Tamaulipas",22785,Tuxtla Gutierrez
801,Grupo Empresarial Coyatoc,"Grupo Empresarial Coyatoc es fundado en 1989 con oficinas centrales en Tuxtla Gutiérrez, capital del estado de Chiapas, México.

Nuestro campo de acci...",9616182266,51-200 empleados,,Construcción,"Tuxtla Gutiérrez, Chiapas",,Tuxtla Gutierrez
802,PM Fármacos,"Distribuidora PM de Occidente, SA de CV; Distribuidor de Medicamentos, Material de Curación y Diversos Dispositivos y Equipo Médico. Especialidad en a...",,11-50 empleados,"Matriz, Almacen General y Farmacia de Especialidades
15 Poniente Norte 561, Tuxtla Gutiérrez, Chiapas MX, Sucursal y Almacén Occidente
Av. Copernico 3947-1, Guadalajara, Jalisco MX, Sucursal y Farmacia de Especialidades
Av Cué Merlo 632-1, Puebla, Puebla MX",Fabricación de productos farmacéuticos,"Guadalajara, Jalisco",,Tuxtla Gutierrez
803,HIGHTECH Process Counselours,"Somos una comunidad innovadora de diseñadores, tecnólogos que vemos al futuro como una oportunidad para crear un impacto positivo a través de la tecno...",9613334037,11-50 empleados,"Principal
Sede
TUXTLA GUTIÉRREZ, MX",Desarrollo de software,,,Tuxtla Gutierrez
